{
  "model": "llama-7b-q4_k.gguf",
  "fingerprint": {
    "file_hash": "a1b2c3d4e5f6a7b8c9d0e1f2a3b4c5d6",
    "structure_hash": "f1e2d3c4b5a6f7e8d9c0b1a2f3e4d5c6",
    "quant_type": "Q4_K",
    "tensor_count": 291,
    "total_parameters": 6738415616,
    "architecture": "llama"
  },
  "policy": {
    "pass": true,
    "violations": []
  },
  "report": {
    "score": 0.0,
    "confidence": "medium",
    "anomalies": [],
    "summary": "no anomalies detected across 291 tensors",
    "layers": {
      "tensor_local": 0.0,
      "role_group": 0.0,
      "model_global": 0.0,
      "reference": 0.0
    }
  },
  "quant_report": {
    "tensors_analyzed": 289,
    "anomalies": []
  },
  "family_match": {
    "family": "llama",
    "match_score": 0.95,
    "matched_roles": 10,
    "total_expected": 12,
    "architecture_match": true,
    "shape_violations": []
  },
  "elapsed": "2.34s"
}
